		
CORTANDO AS LINHAS DE INDUÇÃO	
Observe o disco do experimento.	
Uma de suas metades é constituída de alumínio e a outra, de ferro.	
A peça pintada de vermelho é um imã permanente enquanto que a pequena lâmina verde suspensa é feita de ferro.	
Posicione uma das metades do disco próxima à lâmina.	
Depois posicione a outra metade.	
Por que lâmina verde não é atraída pelo imã quando está próxima ao ferro?	
Porque, diferentemente do alumínio, o ferro é um material capaz de cortar as linhas de indução do campo magnético em que está inserido.	
E o que isso tem a ver com a sua vida?	
Esse conhecimento é indispensável para todas as atividades que envolvem a utilização de imãs.	
Se você precisar de algo que interaja com o imã, por exemplo, você precisará utilizar um material ferromagnético.	
